{
  "$schema": "https://json-schema.org/draft/2020-12/schema",
  "$id": "https://github.com/tt-a1i/archify/schemas/explainer-steps.schema.json",
  "title": "Archify Explainer Steps Diagram",
  "type": "object",
  "additionalProperties": false,
  "required": ["schema_version", "diagram_type", "meta", "steps"],
  "properties": {
    "schema_version": { "const": 1 },
    "diagram_type": { "const": "explainer-steps" },
    "meta": {
      "type": "object",
      "additionalProperties": false,
      "required": ["title"],
      "properties": {
        "title": { "type": "string", "minLength": 1 },
        "subtitle": { "type": "string" },
        "output": { "type": "string" },
        "locale": { "$ref": "common.schema.json#/$defs/locale" },
        "animation": { "enum": ["trace", "none"] },
        "visual_preset": { "enum": ["classic", "signal-flow", "blueprint", "editorial"] },
        "quality_profile": { "enum": ["standard", "showcase"] },
        "views": { "$ref": "common.schema.json#/$defs/guidedViews" },
        "legend": {
          "type": "object",
          "additionalProperties": false,
          "properties": {
            "mode": { "$ref": "common.schema.json#/$defs/legendMode" },
            "entries": {
              "type": "object",
              "additionalProperties": false,
              "properties": {
                "start": { "$ref": "common.schema.json#/$defs/legendEntry" },
                "active": { "$ref": "common.schema.json#/$defs/legendEntry" },
                "waiting": { "$ref": "common.schema.json#/$defs/legendEntry" },
                "decision": { "$ref": "common.schema.json#/$defs/legendEntry" },
                "success": { "$ref": "common.schema.json#/$defs/legendEntry" },
                "failure": { "$ref": "common.schema.json#/$defs/legendEntry" },
                "neutral": { "$ref": "common.schema.json#/$defs/legendEntry" },
                "external": { "$ref": "common.schema.json#/$defs/legendEntry" }
              }
            }
          }
        }
      }
    },
    "steps": {
      "type": "array",
      "minItems": 2,
      "items": {
        "type": "object",
        "additionalProperties": false,
        "required": ["id", "type", "label"],
        "properties": {
          "id": { "$ref": "common.schema.json#/$defs/id" },
          "type": { "enum": ["start", "active", "waiting", "decision", "success", "failure", "neutral", "external"] },
          "label": { "type": "string", "minLength": 1, "maxLength": 60 },
          "sublabel": { "type": "string", "maxLength": 80 },
          "tag": { "type": "string", "maxLength": 24 },
          "description": { "type": "string", "maxLength": 320 },
          "math": { "type": "string", "maxLength": 200 },
          "code": {
            "type": "object",
            "additionalProperties": false,
            "required": ["content"],
            "properties": {
              "language": { "type": "string", "maxLength": 24 },
              "content": { "type": "string", "maxLength": 600 }
            }
          }
        }
      }
    },
    "cards": { "$ref": "common.schema.json#/$defs/cards" }
  }
}
